{
  "cases": [
    {
      "caseId": "seed-acl100",
      "detected": true,
      "diagnostic": {
        "path": "43b3ccf4ae087910c557075b10e2828cd62e0304ffad9f21b165602093b0b71a",
        "semantic": "031eeafff51d09feab8a8b16055a5a539ade77ad68cbdbd0a2915b3e0db9d3b3",
        "severity": "error"
      },
      "disposition": "visible",
      "expectedRuleId": "ACL100",
      "familyId": "syntax-structure",
      "scenarioId": "syntax-acl100"
    },
    {
      "caseId": "seed-acl101",
      "detected": true,
      "diagnostic": {
        "path": "3f9164846d4e02b874a3e86ec37bb9e6ea3fa55adf7d502127222f8c2ee1d5b2",
        "semantic": "d1c647524b3270fe9c3ab0d4925fe2adc77004851e489652bd18caaa22866aaf",
        "severity": "error"
      },
      "disposition": "visible",
      "expectedRuleId": "ACL101",
      "familyId": "syntax-structure",
      "scenarioId": "syntax-acl101"
    },
    {
      "caseId": "seed-acl102",
      "detected": true,
      "diagnostic": {
        "path": "c4d69403d569a0082dabe23a92abdba8ad03b853a21bf47545bba02d6b8dc307",
        "semantic": "b62793e6d9da3b38664d92a25228cc776ff41bd5ef3b46553378f7e06f5c9ae8",
        "severity": "warning"
      },
      "disposition": "visible",
      "expectedRuleId": "ACL102",
      "familyId": "syntax-structure",
      "scenarioId": "syntax-acl102"
    },
    {
      "caseId": "seed-acl103",
      "detected": true,
      "diagnostic": {
        "path": "4791bbef911d8dece71b19414a501aa842785966c707e5387c92160facf49bc4",
        "semantic": "ebf62880a17e79dce7b7581c2ca690a15f778aaf037612a74e03c8b60c84a84b",
        "severity": "error"
      },
      "disposition": "visible",
      "expectedRuleId": "ACL103",
      "familyId": "syntax-structure",
      "scenarioId": "syntax-acl103"
    },
    {
      "caseId": "seed-acl104",
      "detected": true,
      "diagnostic": {
        "path": "11e4da82ce402dffc444cc314231d4376c82d2e7dade976ad51202c18ce06078",
        "semantic": "b7902aea8f4466d1a457212ae48f2360b296a4587e283c214a72c5fc1a350082",
        "severity": "warning"
      },
      "disposition": "visible",
      "expectedRuleId": "ACL104",
      "familyId": "syntax-structure",
      "scenarioId": "syntax-acl104"
    },
    {
      "caseId": "seed-acl105",
      "detected": true,
      "diagnostic": {
        "path": "8794a686e09fc1833b15f941b27f530b48b9a50953b5c01b1d990c6132d3c1a5",
        "semantic": "3c303307eb644a1561f494838c7d91bcce9d5d12c7dd84fba01c1eb98c670be0",
        "severity": "warning"
      },
      "disposition": "visible",
      "expectedRuleId": "ACL105",
      "familyId": "syntax-structure",
      "scenarioId": "syntax-acl105"
    },
    {
      "caseId": "seed-acl106",
      "detected": true,
      "diagnostic": {
        "path": "50d1a221aadd5d1019c94a6540e15f2dc25a6cf1839cbde774d97a18cd9181ae",
        "semantic": "e216c957dbae10da7aa92eacfd18b9b971a0d1b3cd9bc564b2f8bff6dcdf25ff",
        "severity": "warning"
      },
      "disposition": "visible",
      "expectedRuleId": "ACL106",
      "familyId": "syntax-structure",
      "scenarioId": "syntax-acl106"
    },
    {
      "caseId": "seed-acl107",
      "detected": true,
      "diagnostic": {
        "path": "bd51fde080e40d365a91a418e3eee83e3ee3d890de1093a88859f442c3e4ffc3",
        "semantic": "f9c16d0a2fc1c2083a2b22750d76cf53baf905da36a3995d77927eba1b60994d",
        "severity": "warning"
      },
      "disposition": "visible",
      "expectedRuleId": "ACL107",
      "familyId": "syntax-structure",
      "scenarioId": "syntax-acl107"
    },
    {
      "caseId": "seed-acl108",
      "detected": true,
      "diagnostic": {
        "path": "49220f69ba76de7e5f55809c3a101854db2a77a3393b81060185495ebadb59b4",
        "semantic": "ff0452130a204ebd3bc785e0409d1cc0c3f1c9b064a295765f872053b8520361",
        "severity": "warning"
      },
      "disposition": "visible",
      "expectedRuleId": "ACL108",
      "familyId": "syntax-structure",
      "scenarioId": "syntax-acl108"
    },
    {
      "caseId": "seed-acl109",
      "detected": true,
      "diagnostic": {
        "path": "32fb0e18d3e63e5cf2d41b9b7631121c248204097af5fbb21f215af906a7212c",
        "semantic": "41f9358a21ade0dc4bf97680760c9fd13f9cf0e31c62da8f74619b22c460aa37",
        "severity": "warning"
      },
      "disposition": "visible",
      "expectedRuleId": "ACL109",
      "familyId": "syntax-structure",
      "scenarioId": "syntax-acl109"
    },
    {
      "caseId": "seed-acl150",
      "detected": true,
      "diagnostic": {
        "path": "33013b4c4010500e5aeec061e54c6dd706f281b81c3d7d97f6d1f00f7349a837",
        "semantic": "cfaa6d5d6d1af0c04b822d6c26aa90ec4ca6d8671d38a6f23bf8efa1856ed0c9",
        "severity": "error"
      },
      "disposition": "visible",
      "expectedRuleId": "ACL150",
      "familyId": "references-imports",
      "scenarioId": "references-paths"
    },
    {
      "caseId": "seed-acl151",
      "detected": true,
      "diagnostic": {
        "path": "e5137a08855beecdb14b3fe91e93a0155afc28a6a1161ebf08cfe0dc0df2a1a6",
        "semantic": "2dc147d9504f862016785b6dc36b0d801151e06f69f878e39c1a7c9f1c953a34",
        "severity": "error"
      },
      "disposition": "visible",
      "expectedRuleId": "ACL151",
      "familyId": "references-imports",
      "scenarioId": "references-paths"
    },
    {
      "caseId": "seed-acl152",
      "detected": true,
      "diagnostic": {
        "path": "6a6f80c87ac08a53e175ceca43f43c1bbc00e4bfa3bb51e35f647765e5e77f00",
        "semantic": "9240cab788fae72ba671840e100ee1df4ee08c31cb84ac6fd102384f7408a67e",
        "severity": "error"
      },
      "disposition": "visible",
      "expectedRuleId": "ACL152",
      "familyId": "references-imports",
      "scenarioId": "references-paths"
    },
    {
      "caseId": "seed-acl153",
      "detected": true,
      "diagnostic": {
        "path": "eec8a9b4a9bbdc56ccb1c2da0ba4ffc28773eaa42493a28fc313c8fd683ea637",
        "semantic": "4d9c1e975ae4d1342f5d549a216d3aef9a0dad5f72b72219d2d1f62949d2f745",
        "severity": "warning"
      },
      "disposition": "visible",
      "expectedRuleId": "ACL153",
      "familyId": "references-imports",
      "scenarioId": "references-paths"
    },
    {
      "caseId": "seed-acl154",
      "detected": true,
      "diagnostic": {
        "path": "0588f9f61b498968fce66ec638f3fa5c12d40eaf14c7d59f4f617b663eca84cb",
        "semantic": "aa21f1da3da18739de8fc92cef5932bd68953cbb55f1edb1e2c82baaac2ac4d6",
        "severity": "warning"
      },
      "disposition": "visible",
      "expectedRuleId": "ACL154",
      "familyId": "references-imports",
      "scenarioId": "references-paths"
    },
    {
      "caseId": "seed-acl155",
      "detected": true,
      "diagnostic": {
        "path": "ef55d8b66c56e167a5dd7c1de97a5f885c177f4991379c40209a6ddbba729aa2",
        "semantic": "720aa9e17dbb915390272f289612879bd5b2d504084c6f12763777f7353c1ecf",
        "severity": "warning"
      },
      "disposition": "visible",
      "expectedRuleId": "ACL155",
      "familyId": "references-imports",
      "scenarioId": "references-unsupported"
    },
    {
      "caseId": "seed-acl156",
      "detected": true,
      "diagnostic": {
        "path": "dba32db1892f9999905d6ea88f6dce3a2a28ba3730298a043a012f22a6939639",
        "semantic": "bdf509d294be833aab353d16c953704717a4d19dde00b5133a93125341280c44",
        "severity": "warning"
      },
      "disposition": "visible",
      "expectedRuleId": "ACL156",
      "familyId": "references-imports",
      "scenarioId": "references-paths"
    },
    {
      "caseId": "seed-acl200",
      "detected": true,
      "diagnostic": {
        "path": "4472a2d81ed0d9fd7ada0fe6029e690b37fca17aec902cbfc3354409ca214362",
        "semantic": "d3a08723dcfb253f2281e2466c35b5f206aec189ffc570de41e8289c65262e47",
        "severity": "error"
      },
      "disposition": "visible",
      "expectedRuleId": "ACL200",
      "familyId": "scope-activation",
      "scenarioId": "scope-acl200"
    },
    {
      "caseId": "seed-acl201",
      "detected": true,
      "diagnostic": {
        "path": "65b4f1923ca29ed0b15645a670e6879b48ca385af054f2ea11d0af443965967f",
        "semantic": "9a5b3e3d5d8cbac03c22a8f0e12f220b2a86b8d5d49b1ad3e00be0ed8b2375a0",
        "severity": "warning"
      },
      "disposition": "visible",
      "expectedRuleId": "ACL201",
      "familyId": "scope-activation",
      "scenarioId": "scope-acl201"
    },
    {
      "caseId": "seed-acl202",
      "detected": true,
      "diagnostic": {
        "path": "c060267bb74b6ff9cbfc6accaa4416684b53571485e3253d56cbe7501a195f9e",
        "semantic": "9e7e6bdc96e0c133530d6a2152c1988dbfeac1172c5519b102139b86951d2171",
        "severity": "warning"
      },
      "disposition": "visible",
      "expectedRuleId": "ACL202",
      "familyId": "scope-activation",
      "scenarioId": "scope-acl202"
    },
    {
      "caseId": "seed-acl203",
      "detected": true,
      "diagnostic": {
        "path": "337f7d994c91d81e051b0f4c8c90af82db81c43fec5be1e541c7eafdaf2a3aff",
        "semantic": "b9bffa047d9d920e3e2ce837c2ecc4526abd113836db1747e82d87d26e27eb42",
        "severity": "warning"
      },
      "disposition": "visible",
      "expectedRuleId": "ACL203",
      "familyId": "scope-activation",
      "scenarioId": "scope-acl203"
    },
    {
      "caseId": "seed-acl204",
      "detected": true,
      "diagnostic": {
        "path": "f7e0b95a76a9eef826d25af26c82e91560500fcc410b38a0462fb745d1d4d575",
        "semantic": "d8ab6d458d251b2451b3738e54a4a899bc507b0f07c3e832ac76cfea5e37f690",
        "severity": "warning"
      },
      "disposition": "visible",
      "expectedRuleId": "ACL204",
      "familyId": "scope-activation",
      "scenarioId": "scope-acl204"
    },
    {
      "caseId": "seed-acl205",
      "detected": true,
      "diagnostic": {
        "path": "8d319af17dabd14935990361b843533da79b53215b3d4fb886c97f293db7fdc0",
        "semantic": "2cbbcb7964870e28280d74783e0403a6914ffd2ace665d8eb5e364325385b713",